[
  {
    "rule_id": "raw_materials_upstream_price_increase",
    "trigger": {
      "scenario": "raw_materials",
      "event_type": "upstream_price",
      "direction": "increase"
    },
    "target_component": "profit_margin",
    "function_name": "linear_adjustment",
    "params": {
      "base_impact": -0.02
    },
    "explanation": "Higher upstream prices increase costs and reduce profit margin.",
    "business_chain": "raw material and component prices -> cost of goods sold -> gross margin / profit_margin -> cumulative ROA",
    "fundamental_basis": "Fundamental Analyst business-model prior from Sungrow 2020 annual report and later disclosed reports; metadata only, base_impact unchanged.",
    "operating_metric_links": [
      "gross_margin",
      "profit_margin",
      "inventory",
      "operating_cash_flow"
    ]
  },
  {
    "rule_id": "raw_materials_upstream_price_decrease",
    "trigger": {
      "scenario": "raw_materials",
      "event_type": "upstream_price",
      "direction": "decrease"
    },
    "target_component": "profit_margin",
    "function_name": "linear_adjustment",
    "params": {
      "base_impact": 0.02
    },
    "explanation": "Lower upstream prices reduce costs and improve profit margin.",
    "business_chain": "raw material and component prices -> cost of goods sold -> gross margin / profit_margin -> cumulative ROA",
    "fundamental_basis": "Fundamental Analyst business-model prior from Sungrow 2020 annual report and later disclosed reports; metadata only, base_impact unchanged.",
    "operating_metric_links": [
      "gross_margin",
      "profit_margin",
      "inventory",
      "operating_cash_flow"
    ]
  },
  {
    "rule_id": "raw_materials_supply_condition_increase",
    "trigger": {
      "scenario": "raw_materials",
      "event_type": "supply_condition",
      "direction": "increase"
    },
    "target_component": "profit_margin",
    "function_name": "linear_adjustment",
    "params": {
      "base_impact": -0.015
    },
    "explanation": "Tighter supply conditions increase cost pressure and reduce margins.",
    "business_chain": "raw material and component prices -> cost of goods sold -> gross margin / profit_margin -> cumulative ROA",
    "fundamental_basis": "Fundamental Analyst business-model prior from Sungrow 2020 annual report and later disclosed reports; metadata only, base_impact unchanged.",
    "operating_metric_links": [
      "gross_margin",
      "profit_margin",
      "inventory",
      "operating_cash_flow"
    ]
  },
  {
    "rule_id": "raw_materials_supply_condition_decrease",
    "trigger": {
      "scenario": "raw_materials",
      "event_type": "supply_condition",
      "direction": "decrease"
    },
    "target_component": "profit_margin",
    "function_name": "linear_adjustment",
    "params": {
      "base_impact": 0.015
    },
    "explanation": "Easing supply conditions relieve cost pressure and support margins.",
    "business_chain": "raw material and component prices -> cost of goods sold -> gross margin / profit_margin -> cumulative ROA",
    "fundamental_basis": "Fundamental Analyst business-model prior from Sungrow 2020 annual report and later disclosed reports; metadata only, base_impact unchanged.",
    "operating_metric_links": [
      "gross_margin",
      "profit_margin",
      "inventory",
      "operating_cash_flow"
    ]
  },
  {
    "rule_id": "raw_materials_industry_policy_increase",
    "trigger": {
      "scenario": "raw_materials",
      "event_type": "industry_policy",
      "direction": "increase"
    },
    "target_component": "profit_margin",
    "function_name": "linear_adjustment",
    "params": {
      "base_impact": 0.011999999999999999
    },
    "explanation": "Supportive industry policy improves pricing discipline and profit margin.",
    "business_chain": "raw material and component prices -> cost of goods sold -> gross margin / profit_margin -> cumulative ROA",
    "fundamental_basis": "Fundamental Analyst business-model prior from Sungrow 2020 annual report and later disclosed reports; metadata only, base_impact unchanged.",
    "operating_metric_links": [
      "gross_margin",
      "profit_margin",
      "inventory",
      "operating_cash_flow"
    ]
  },
  {
    "rule_id": "raw_materials_industry_policy_decrease",
    "trigger": {
      "scenario": "raw_materials",
      "event_type": "industry_policy",
      "direction": "decrease"
    },
    "target_component": "profit_margin",
    "function_name": "linear_adjustment",
    "params": {
      "base_impact": -0.01
    },
    "explanation": "Weaker industry policy support increases competition and hurts margins.",
    "business_chain": "raw material and component prices -> cost of goods sold -> gross margin / profit_margin -> cumulative ROA",
    "fundamental_basis": "Fundamental Analyst business-model prior from Sungrow 2020 annual report and later disclosed reports; metadata only, base_impact unchanged.",
    "operating_metric_links": [
      "gross_margin",
      "profit_margin",
      "inventory",
      "operating_cash_flow"
    ]
  },
  {
    "rule_id": "raw_materials_cost_volatility_increase",
    "trigger": {
      "scenario": "raw_materials",
      "event_type": "cost_volatility",
      "direction": "increase"
    },
    "target_component": "profit_margin",
    "function_name": "linear_adjustment",
    "params": {
      "base_impact": -0.011999999999999999
    },
    "explanation": "Higher raw material cost volatility increases margin uncertainty and downside risk.",
    "business_chain": "raw material and component prices -> cost of goods sold -> gross margin / profit_margin -> cumulative ROA",
    "fundamental_basis": "Fundamental Analyst business-model prior from Sungrow 2020 annual report and later disclosed reports; metadata only, base_impact unchanged.",
    "operating_metric_links": [
      "gross_margin",
      "profit_margin",
      "inventory",
      "operating_cash_flow"
    ]
  },
  {
    "rule_id": "raw_materials_cost_volatility_decrease",
    "trigger": {
      "scenario": "raw_materials",
      "event_type": "cost_volatility",
      "direction": "decrease"
    },
    "target_component": "profit_margin",
    "function_name": "linear_adjustment",
    "params": {
      "base_impact": 0.008
    },
    "explanation": "Lower cost volatility supports margin stability.",
    "business_chain": "raw material and component prices -> cost of goods sold -> gross margin / profit_margin -> cumulative ROA",
    "fundamental_basis": "Fundamental Analyst business-model prior from Sungrow 2020 annual report and later disclosed reports; metadata only, base_impact unchanged.",
    "operating_metric_links": [
      "gross_margin",
      "profit_margin",
      "inventory",
      "operating_cash_flow"
    ]
  },
  {
    "rule_id": "manufacturing_manufacturing_technology_increase",
    "trigger": {
      "scenario": "manufacturing",
      "event_type": "manufacturing_technology",
      "direction": "increase"
    },
    "target_component": "profit_margin",
    "function_name": "linear_adjustment",
    "params": {
      "base_impact": 0.015
    },
    "explanation": "Improved manufacturing technology supports efficiency and profit margin.",
    "business_chain": "capacity, factories, and manufacturing efficiency -> delivery capability and fixed asset base -> asset_turnover -> cumulative ROA",
    "fundamental_basis": "Fundamental Analyst business-model prior from Sungrow 2020 annual report and later disclosed reports; metadata only, base_impact unchanged.",
    "operating_metric_links": [
      "fixed_assets",
      "total_assets",
      "asset_turnover",
      "inventory"
    ]
  },
  {
    "rule_id": "manufacturing_manufacturing_technology_decrease",
    "trigger": {
      "scenario": "manufacturing",
      "event_type": "manufacturing_technology",
      "direction": "decrease"
    },
    "target_component": "profit_margin",
    "function_name": "linear_adjustment",
    "params": {
      "base_impact": -0.01
    },
    "explanation": "Weakening manufacturing technology advantage reduces margin support.",
    "business_chain": "capacity, factories, and manufacturing efficiency -> delivery capability and fixed asset base -> asset_turnover -> cumulative ROA",
    "fundamental_basis": "Fundamental Analyst business-model prior from Sungrow 2020 annual report and later disclosed reports; metadata only, base_impact unchanged.",
    "operating_metric_links": [
      "fixed_assets",
      "total_assets",
      "asset_turnover",
      "inventory"
    ]
  },
  {
    "rule_id": "manufacturing_production_efficiency_increase",
    "trigger": {
      "scenario": "manufacturing",
      "event_type": "production_efficiency",
      "direction": "increase"
    },
    "target_component": "asset_turnover",
    "function_name": "linear_adjustment",
    "params": {
      "base_impact": 0.02
    },
    "explanation": "Higher production efficiency improves asset turnover.",
    "business_chain": "capacity, factories, and manufacturing efficiency -> delivery capability and fixed asset base -> asset_turnover -> cumulative ROA",
    "fundamental_basis": "Fundamental Analyst business-model prior from Sungrow 2020 annual report and later disclosed reports; metadata only, base_impact unchanged.",
    "operating_metric_links": [
      "fixed_assets",
      "total_assets",
      "asset_turnover",
      "inventory"
    ]
  },
  {
    "rule_id": "manufacturing_production_efficiency_decrease",
    "trigger": {
      "scenario": "manufacturing",
      "event_type": "production_efficiency",
      "direction": "decrease"
    },
    "target_component": "asset_turnover",
    "function_name": "linear_adjustment",
    "params": {
      "base_impact": -0.02
    },
    "explanation": "Lower production efficiency reduces asset turnover.",
    "business_chain": "capacity, factories, and manufacturing efficiency -> delivery capability and fixed asset base -> asset_turnover -> cumulative ROA",